{
  "schema_version": "1.0",
  "flow_id": "ins-007-risky",
  "variant": "risky",
  "pair_id": "ins-007",
  "sector": "insurance",
  "flow_type": "join",
  "screens": [
    {
      "screen_index": 1,
      "image": "ins-007-risky/01.png",
      "viewport": {
        "width": 390,
        "height": 844
      }
    },
    {
      "screen_index": 2,
      "image": "ins-007-risky/02.png",
      "viewport": {
        "width": 390,
        "height": 844
      }
    },
    {
      "screen_index": 3,
      "image": "ins-007-risky/03.png",
      "viewport": {
        "width": 390,
        "height": 844
      }
    },
    {
      "screen_index": 4,
      "image": "ins-007-risky/04.png",
      "viewport": {
        "width": 390,
        "height": 844
      }
    },
    {
      "screen_index": 5,
      "image": "ins-007-risky/05.png",
      "viewport": {
        "width": 390,
        "height": 844
      }
    }
  ],
  "labels": [
    {
      "rule_id": "DA-15",
      "label_unit": "flow",
      "screen_indices": [
        1,
        4
      ],
      "severity": "HIGH",
      "mitigated": false
    }
  ],
  "deferred": []
}
