{
  "schema_version": "1.0",
  "flow_id": "ins-004-risky",
  "variant": "risky",
  "pair_id": "ins-004",
  "sector": "insurance",
  "flow_type": "join",
  "screens": [
    {
      "screen_index": 1,
      "image": "ins-004-risky/01.png",
      "viewport": {
        "width": 390,
        "height": 844
      }
    },
    {
      "screen_index": 2,
      "image": "ins-004-risky/02.png",
      "viewport": {
        "width": 390,
        "height": 844
      }
    },
    {
      "screen_index": 3,
      "image": "ins-004-risky/03.png",
      "viewport": {
        "width": 390,
        "height": 844
      }
    },
    {
      "screen_index": 4,
      "image": "ins-004-risky/04.png",
      "viewport": {
        "width": 390,
        "height": 844
      }
    },
    {
      "screen_index": 5,
      "image": "ins-004-risky/05.png",
      "viewport": {
        "width": 390,
        "height": 844
      }
    }
  ],
  "labels": [
    {
      "rule_id": "DA-07",
      "label_unit": "element",
      "primary": {
        "screen_index": 1,
        "bbox": [
          0.0462,
          0.7155,
          0.9077,
          0.0455
        ],
        "text": "본 보험은 예금자보호법에 따라 보호되지 않는 상품이며, 중도 해지 시 해약환급금이 납입한 보험료보다 적거나 ",
        "element_type": "text"
      },
      "related_elements": [],
      "severity": "HIGH",
      "mitigated": false
    },
    {
      "rule_id": "DA-07",
      "label_unit": "element",
      "primary": {
        "screen_index": 5,
        "bbox": [
          0.0462,
          0.4951,
          0.9077,
          0.0304
        ],
        "text": "청약 후 15일 이내 청약철회가 가능하며, 보험금 지급사유 발생 시 약관에 따라 지급이 제한될 수 있습니다.",
        "element_type": "text"
      },
      "related_elements": [],
      "severity": "HIGH",
      "mitigated": false
    }
  ],
  "deferred": []
}
