{
  "schema_version": "1.0",
  "flow_id": "ins-008-risky",
  "variant": "risky",
  "pair_id": "ins-008",
  "sector": "insurance",
  "flow_type": "join",
  "screens": [
    {
      "screen_index": 1,
      "image": "ins-008-risky/01.png",
      "viewport": {
        "width": 390,
        "height": 844
      }
    },
    {
      "screen_index": 2,
      "image": "ins-008-risky/02.png",
      "viewport": {
        "width": 390,
        "height": 844
      }
    },
    {
      "screen_index": 3,
      "image": "ins-008-risky/03.png",
      "viewport": {
        "width": 390,
        "height": 844
      }
    },
    {
      "screen_index": 4,
      "image": "ins-008-risky/04.png",
      "viewport": {
        "width": 390,
        "height": 844
      }
    },
    {
      "screen_index": 5,
      "image": "ins-008-risky/05.png",
      "viewport": {
        "width": 390,
        "height": 844
      }
    }
  ],
  "labels": [
    {
      "rule_id": "DA-05",
      "label_unit": "element",
      "primary": {
        "screen_index": 1,
        "bbox": [
          0.0462,
          0.1623,
          0.2779,
          0.0299
        ],
        "text": "업계 최저 보험료",
        "element_type": "text"
      },
      "related_elements": [],
      "severity": "HIGH",
      "mitigated": false
    }
  ],
  "deferred": []
}
