{
  "schema_version": "1.0",
  "flow_id": "dep-001-risky",
  "variant": "risky",
  "pair_id": "dep-001",
  "sector": "deposit",
  "flow_type": "join",
  "screens": [
    {
      "screen_index": 1,
      "image": "dep-001-risky/01.png",
      "viewport": {
        "width": 390,
        "height": 844
      }
    },
    {
      "screen_index": 2,
      "image": "dep-001-risky/02.png",
      "viewport": {
        "width": 390,
        "height": 844
      }
    },
    {
      "screen_index": 3,
      "image": "dep-001-risky/03.png",
      "viewport": {
        "width": 390,
        "height": 844
      }
    },
    {
      "screen_index": 4,
      "image": "dep-001-risky/04.png",
      "viewport": {
        "width": 390,
        "height": 844
      }
    },
    {
      "screen_index": 5,
      "image": "dep-001-risky/05.png",
      "viewport": {
        "width": 390,
        "height": 844
      }
    }
  ],
  "labels": [
    {
      "rule_id": "DA-03",
      "label_unit": "element",
      "primary": {
        "screen_index": 5,
        "bbox": [
          0.3434,
          0.8886,
          0.6105,
          0.0806
        ],
        "text": "가입 완료하기",
        "element_type": "button"
      },
      "related_elements": [
        {
          "screen_index": 5,
          "bbox": [
            0.0462,
            0.8886,
            0.2742,
            0.0806
          ],
          "text": "우대금리를 포기할게요",
          "element_type": "button"
        }
      ],
      "severity": "HIGH",
      "mitigated": false
    },
    {
      "rule_id": "DA-04",
      "label_unit": "element",
      "primary": {
        "screen_index": 3,
        "bbox": [
          0.0897,
          0.2901,
          0.0538,
          0.0249
        ],
        "element_type": "checkbox"
      },
      "related_elements": [],
      "severity": "HIGH",
      "mitigated": false
    },
    {
      "rule_id": "DA-05",
      "label_unit": "element",
      "primary": {
        "screen_index": 1,
        "bbox": [
          0.0462,
          0.1623,
          0.3169,
          0.0299
        ],
        "text": "업계 최고 수준 금리",
        "element_type": "text"
      },
      "related_elements": [],
      "severity": "HIGH",
      "mitigated": false
    },
    {
      "rule_id": "DA-07",
      "label_unit": "element",
      "primary": {
        "screen_index": 1,
        "bbox": [
          0.0462,
          0.6785,
          0.9077,
          0.0455
        ],
        "text": "이 예금은 예금자보호법에 따라 예금보험공사가 보호하되, 보호 한도는 본 은행에 있는 모든 예금보호대상 금융상",
        "element_type": "text"
      },
      "related_elements": [],
      "severity": "HIGH",
      "mitigated": false
    },
    {
      "rule_id": "DA-07",
      "label_unit": "element",
      "primary": {
        "screen_index": 2,
        "bbox": [
          0.0462,
          0.424,
          0.9077,
          0.0741
        ],
        "text": "우대조건 자세히 보기\n›",
        "element_type": "text"
      },
      "related_elements": [],
      "severity": "HIGH",
      "mitigated": false
    },
    {
      "rule_id": "DA-07",
      "label_unit": "element",
      "primary": {
        "screen_index": 5,
        "bbox": [
          0.0462,
          0.4951,
          0.9077,
          0.0304
        ],
        "text": "만기 전 중도해지 시 약정 금리가 아닌 중도해지이율이 적용되어 이자가 크게 줄어들 수 있습니다.",
        "element_type": "text"
      },
      "related_elements": [],
      "severity": "HIGH",
      "mitigated": false
    },
    {
      "rule_id": "DA-12",
      "label_unit": "element",
      "primary": {
        "screen_index": 5,
        "bbox": [
          0.0462,
          0.8886,
          0.2742,
          0.0806
        ],
        "text": "우대금리를 포기할게요",
        "element_type": "button"
      },
      "related_elements": [],
      "severity": "REVIEW",
      "mitigated": false
    },
    {
      "rule_id": "DA-13",
      "label_unit": "element",
      "primary": {
        "screen_index": 3,
        "bbox": [
          0.0692,
          0.2723,
          0.8615,
          0.0847
        ],
        "text": "마케팅 정보 수신 동의\n상품·이벤트 안내 (선택)\n우대 +0.5%p",
        "element_type": "text"
      },
      "related_elements": [],
      "severity": "REVIEW",
      "mitigated": false
    },
    {
      "rule_id": "DA-15",
      "label_unit": "flow",
      "screen_indices": [
        1,
        4
      ],
      "severity": "HIGH",
      "mitigated": false
    }
  ],
  "deferred": []
}
